Issue Type,Summary,Epic Name,Parent,Description,Priority,Story Points,Labels,Components
Epic,Authentication & User Management,Authentication & User Management,,Core user authentication registration profile management and security features,High,89,authentication security oauth,Authentication
Epic,Social Media Integration,Social Media Integration,,Integration with 11 social media platforms for content extraction and analysis,High,55,social-media integration platforms,Social Media
Epic,AI-Powered Content Analysis,AI-Powered Content Analysis,,Advanced AI analysis including transcription sentiment analysis object detection and multimedia processing,Highest,144,ai-analysis machine-learning nlp,AI Analysis
Epic,Contacts Management System,Contacts Management System,,Comprehensive contact management with relationships groups and integration features,High,89,contacts crm relationships,Contacts
Epic,Content Sharing & Collaboration,Content Sharing & Collaboration,,Content sharing collaboration features permissions and team management,Medium,34,sharing collaboration permissions,Sharing
Epic,File Management & Storage,File Management & Storage,,File upload processing organization and cloud storage integration,High,55,file-management storage cloud,File Management
Epic,Administration & System Management,Administration & System Management,,User administration system configuration monitoring and contact management for admins,Medium,89,administration system-management monitoring,Administration
Epic,Multimedia Testing System,Multimedia Testing System,,Comprehensive testing framework for multimedia analysis with automated workflows,Medium,55,testing automation multimedia,Testing
Epic,Multilingual & Accessibility,Multilingual & Accessibility,,Multi-language support and accessibility features for inclusive user experience,Low,34,i18n accessibility wcag,Internationalization
Epic,Security & Compliance,Security & Compliance,,Data protection GDPR compliance security monitoring and threat detection,Highest,34,security compliance gdpr,Security
Epic,Integration & API,Integration & API,,External service integrations and RESTful API development,High,34,api integration external-services,Integration
Epic,Mobile & Responsive Design,Mobile & Responsive Design,,Mobile compatibility responsive design and touch-friendly interfaces,Medium,21,mobile responsive-design ui,Mobile
Epic,Analytics & Reporting,Analytics & Reporting,,User analytics business intelligence and comprehensive reporting system,Low,34,analytics reporting business-intelligence,Analytics
Story,Register with email/password authentication,Authentication & User Management,Authentication & User Management,Implement user registration functionality with email verification and secure password requirements,High,3,authentication registration email-verification,Authentication
Story,Register using Google OAuth 2.0,Authentication & User Management,Authentication & User Management,Enable user registration through Google OAuth 2.0 integration with proper token management,High,5,oauth google authentication social-login,Authentication
Story,Register using Microsoft OAuth 2.0,Authentication & User Management,Authentication & User Management,Enable user registration through Microsoft OAuth 2.0 integration with proper token management,High,5,oauth microsoft authentication social-login,Authentication
Story,Register using Apple OAuth 2.0,Authentication & User Management,Authentication & User Management,Enable user registration through Apple OAuth 2.0 integration with proper token management,High,5,oauth apple authentication social-login,Authentication
Story,Email verification after registration,Authentication & User Management,Authentication & User Management,Implement email verification system with secure tokens and resend functionality,Medium,3,email-verification security,Authentication
Story,Login with username/password,Authentication & User Management,Authentication & User Management,Implement secure login functionality with rate limiting and account lockout protection,High,3,login authentication security,Authentication
Story,Login with social media accounts,Authentication & User Management,Authentication & User Management,Enable login through connected social media accounts (Google Microsoft Apple),High,3,social-login oauth authentication,Authentication
Story,Password reset via email,Authentication & User Management,Authentication & User Management,Implement secure password reset functionality with email verification and token expiration,Medium,5,password-reset email security,Authentication
Story,Enable/disable Two-Factor Authentication (2FA),Authentication & User Management,Authentication & User Management,Implement 2FA functionality with TOTP support and backup codes,Medium,8,2fa security totp backup-codes,Authentication
Story,Link additional OAuth accounts to existing user,Authentication & User Management,Authentication & User Management,Allow users to link multiple OAuth providers to their existing account,Medium,5,oauth account-linking social-accounts,Authentication
Story,Link Facebook account for content access,Social Media Integration,Social Media Integration,Enable Facebook account linking for content extraction and analysis,High,5,facebook social-media account-linking content-extraction,Social Media
Story,Link YouTube account for video analysis,Social Media Integration,Social Media Integration,Enable YouTube account linking for video content extraction and analysis,High,5,youtube video-analysis account-linking content-extraction,Social Media
Story,Link Instagram account for photo/story analysis,Social Media Integration,Social Media Integration,Enable Instagram account linking for photo and story content analysis,High,5,instagram photo-analysis story-analysis account-linking,Social Media
Story,Link TikTok account for video content,Social Media Integration,Social Media Integration,Enable TikTok account linking for video content extraction and analysis,High,5,tiktok video-content account-linking content-extraction,Social Media
Story,Link WeChat account for messaging,Social Media Integration,Social Media Integration,Enable WeChat account linking for messaging content analysis,Medium,5,wechat messaging account-linking content-analysis,Social Media
Story,Extract mentions from connected social accounts,Social Media Integration,Social Media Integration,Extract and analyze mentions from connected social media platforms,Medium,5,mentions extraction social-media content-analysis,Social Media
Story,Extract direct messages from platforms,Social Media Integration,Social Media Integration,Extract and analyze direct messages from supported messaging platforms,Medium,8,direct-messages extraction messaging content-analysis,Social Media
Story,Submit YouTube video URL for analysis,AI-Powered Content Analysis,AI-Powered Content Analysis,Enable URL submission for YouTube video content analysis,High,5,youtube url-submission video-analysis content-processing,AI Analysis
Story,Submit Instagram post/story URL,AI-Powered Content Analysis,AI-Powered Content Analysis,Enable URL submission for Instagram post and story analysis,High,5,instagram url-submission post-analysis story-analysis,AI Analysis
Story,Object Detection - Identify objects in images and video frames,AI-Powered Content Analysis,AI-Powered Content Analysis,Implement AI-powered object detection for images and video content,High,13,object-detection ai-analysis images video computer-vision,AI Analysis
Story,Audio Transcription - Convert speech to text with speaker identification,AI-Powered Content Analysis,AI-Powered Content Analysis,Implement speech-to-text transcription with speaker identification capabilities,High,13,audio-transcription speech-to-text speaker-identification ai-analysis,AI Analysis
Story,Sentiment Analysis - Analyze emotional tone and mood,AI-Powered Content Analysis,AI-Powered Content Analysis,Implement AI-powered sentiment analysis for emotional tone and mood detection,High,8,sentiment-analysis emotion-detection mood-analysis ai-nlp,AI Analysis
Story,Content Summarization - Generate AI summaries of content,AI-Powered Content Analysis,AI-Powered Content Analysis,Implement AI-powered content summarization for automatic summary generation,High,8,content-summarization ai-summary automatic-summary nlp,AI Analysis
Story,Upload files directly from device,AI-Powered Content Analysis,AI-Powered Content Analysis,Enable direct file upload from user's device for analysis,High,5,file-upload device-upload local-files content-processing,AI Analysis
Story,Create new contact with basic information,Contacts Management System,Contacts Management System,Enable creation of new contacts with essential contact information,High,3,contact-creation basic-information contact-management crm,Contacts
Story,Add multiple phone numbers with custom labels,Contacts Management System,Contacts Management System,Enable adding multiple phone numbers with custom labels to contacts,Medium,3,phone-numbers custom-labels contact-details contact-management,Contacts
Story,Add multiple email addresses with custom labels,Contacts Management System,Contacts Management System,Enable adding multiple email addresses with custom labels to contacts,Medium,3,email-addresses custom-labels contact-details contact-management,Contacts
Story,Create contact groups,Contacts Management System,Contacts Management System,Enable creation of contact groups (Friends Work Family etc.),Medium,3,contact-groups group-management organization contact-management,Contacts
Story,Define relationships between contacts,Contacts Management System,Contacts Management System,Enable defining relationships between contacts (father mother spouse etc.),Medium,5,contact-relationships family-relationships relationship-management contact-management,Contacts
Story,Live search across all contact fields,Contacts Management System,Contacts Management System,Implement live search functionality across all contact fields,High,5,live-search contact-search real-time-search search-functionality,Contacts
Story,Import contacts from CSV files,Contacts Management System,Contacts Management System,Enable importing contacts from CSV files with mapping functionality,Medium,5,csv-import contact-import data-migration bulk-operations,Contacts
Story,Share individual content items with specific contacts,Content Sharing & Collaboration,Content Sharing & Collaboration,Enable sharing of individual content items with selected contacts,High,5,content-sharing individual-sharing contact-sharing sharing-permissions,Sharing
Story,Share content with contact groups,Content Sharing & Collaboration,Content Sharing & Collaboration,Enable sharing content with entire contact groups simultaneously,Medium,5,group-sharing content-sharing bulk-sharing contact-groups,Sharing
Story,Generate shareable links for content,Content Sharing & Collaboration,Content Sharing & Collaboration,Enable generation of shareable links for content access,High,8,shareable-links link-generation content-access external-sharing,Sharing
Story,Set sharing permissions and expiration,Content Sharing & Collaboration,Content Sharing & Collaboration,Implement sharing permissions and expiration date management,Medium,5,sharing-permissions expiration access-control permission-management,Sharing
Story,Upload images (multiple formats),File Management & Storage,File Management & Storage,Enable upload of images in various formats (JPG JPEG PNG GIF BMP WebP SVG TIFF),High,5,image-upload file-upload multiple-formats image-processing,File Management
Story,Upload audio files (multiple formats),File Management & Storage,File Management & Storage,Enable upload of audio files in various formats (MP3 WAV M4A AAC OGG FLAC WMA),High,5,audio-upload file-upload multiple-formats audio-processing,File Management
Story,Upload video files (multiple formats),File Management & Storage,File Management & Storage,Enable upload of video files in various formats (MP4 AVI MOV WMV FLV WebM MKV),High,5,video-upload file-upload multiple-formats video-processing,File Management
Story,File type validation,File Management & Storage,File Management & Storage,Implement comprehensive file type validation and restrictions,Medium,3,file-validation type-validation security file-processing,File Management
Story,Cloud storage integration,File Management & Storage,File Management & Storage,Implement Google Cloud Storage integration for file storage,High,8,cloud-storage google-cloud-storage integration storage-backend,File Management
Story,View all users with pagination and search,Administration & System Management,Administration & System Management,Implement admin interface to view all users with pagination and search,High,5,user-management admin-interface pagination search user-administration,Administration
Story,Create new user accounts,Administration & System Management,Administration & System Management,Enable administrators to create new user accounts,Medium,5,user-creation admin-functionality account-management user-administration,Administration
Story,Assign roles and permissions,Administration & System Management,Administration & System Management,Enable administrators to assign roles and permissions to users,High,8,role-management permissions rbac user-authorization admin-functionality,Administration
Story,Configure login attempt limits,Administration & System Management,Administration & System Management,Enable configuration of login attempt limits and thresholds,Medium,3,login-limits security-configuration admin-settings system-configuration,Administration
Story,Monitor API usage and quotas,Administration & System Management,Administration & System Management,Enable monitoring of API usage and quota tracking,Medium,5,api-monitoring usage-tracking quota-management system-monitoring,Administration
Story,Execute comprehensive multimedia testing workflow,Multimedia Testing System,Multimedia Testing System,Enable execution of comprehensive multimedia testing workflows,High,8,test-execution multimedia-testing testing-workflow automation,Testing
Story,Real-time progress monitoring with percentage completion,Multimedia Testing System,Multimedia Testing System,Implement real-time progress monitoring with percentage completion for tests,Medium,5,progress-monitoring real-time testing-framework monitoring,Testing
Story,View detailed test results with summaries,Multimedia Testing System,Multimedia Testing System,Enable viewing of detailed test results with comprehensive summaries,Medium,5,test-results result-display testing-framework result-analysis,Testing
Story,Switch interface language to English,Multilingual & Accessibility,Multilingual & Accessibility,Enable switching interface language to English,Low,2,language-switching english i18n localization,Internationalization
Story,WCAG 2.1 AA compliance,Multilingual & Accessibility,Multilingual & Accessibility,Implement WCAG 2.1 AA accessibility compliance throughout the application,High,13,wcag accessibility compliance standards,Accessibility
Story,Keyboard navigation support,Multilingual & Accessibility,Multilingual & Accessibility,Implement comprehensive keyboard navigation support,Medium,8,keyboard-navigation accessibility user-interaction,Accessibility
Story,GDPR compliance with data export,Security & Compliance,Security & Compliance,Implement comprehensive GDPR compliance with data export functionality,High,8,gdpr data-export compliance privacy,Security
Story,Data encryption at rest and in transit,Security & Compliance,Security & Compliance,Implement comprehensive data encryption at rest and in transit,High,8,encryption data-security security rest-transit,Security
Story,Real-time security threat detection,Security & Compliance,Security & Compliance,Implement real-time security threat detection and monitoring,High,13,threat-detection security-monitoring real-time security,Security
Story,Google Cloud Speech-to-Text integration,Integration & API,Integration & API,Implement Google Cloud Speech-to-Text API integration,High,8,google-cloud speech-to-text api-integration ai-services,Integration
Story,RESTful API for content management,Integration & API,Integration & API,Implement RESTful API endpoints for content management,High,8,restful-api content-management api-development,API
Story,API authentication and authorization,Integration & API,Integration & API,Implement comprehensive API authentication and authorization,High,8,api-authentication authorization security api-security,API
Story,Responsive design for smartphones,Mobile & Responsive Design,Mobile & Responsive Design,Implement responsive design optimized for smartphones,High,8,responsive-design mobile-optimization smartphone-ui,Mobile
Story,Touch-friendly interface elements,Mobile & Responsive Design,Mobile & Responsive Design,Implement touch-friendly interface elements for mobile devices,Medium,5,touch-interface mobile-ui user-experience,Mobile
Story,User engagement tracking,Analytics & Reporting,Analytics & Reporting,Implement comprehensive user engagement tracking and analytics,Medium,5,engagement-tracking user-analytics analytics,Analytics
Story,Dashboard with key metrics,Analytics & Reporting,Analytics & Reporting,Implement analytics dashboard with key business metrics,High,8,analytics-dashboard metrics-dashboard business-intelligence,Analytics
